{
    "$schema": "http://json-schema.org/draft-07/schema#",
    "title": "SocialMediaMetric",
    "description": "A data model to represent a single metric collected from a social media account.",
    "type": "object",
    "required": [
      "id",
      "type",
      "platform",
      "account_id",
      "metric",
      "value",
      "organic",
      "status_date",
      "granularity",
      "company_name"
    ],
    "properties": {
      "id": {
        "type": "string",
        "description": "Unique identifier of the metric record"
      },
      "type": {
        "type": "string",
        "enum": ["SocialMediaMetric"]
      },
      "platform": {
        "type": "string",
        "description": "Name of the social media platform (e.g., Facebook, Instagram)"
      },
      "account_id": {
        "type": "string",
        "description": "Identifier of the account in the platform"
      },
      "metric": {
        "type": "string",
        "description": "Name of the measured metric (e.g., followers, likes)"
      },
      "value": {
        "type": "number",
        "description": "Numeric value of the metric"
      },
      "organic": {
        "type": "boolean",
        "description": "Whether the metric is organic (true) or paid (false)"
      },
      "status_date": {
        "type": "string",
        "format": "date-time",
        "description": "Timestamp when the metric was recorded"
      },
      "granularity": {
        "type": "string",
        "description": "Aggregation level of the metric (e.g., daily, monthly)"
      },
      "company_name": {
        "type": "string",
        "description": "Name of the company associated with the account"
      }
    },
    "additionalProperties": false
}
